{
  "$schema": "http://json-schema.org/draft-07/schema#",
  "$comment": "GENERATED by gui/schema-gen/derive_nf_config_schemas.py from config/dccf.json + its source (ADR-0425). Do not edit; regenerate.",
  "title": "dccf",
  "type": "object",
  "additionalProperties": false,
  "properties": {
    "port": {
      "type": "integer",
      "x-env-override": "DCCF_PORT",
      "x-cpp-type": "unsigned short"
    },
    "advertised_ipv4": {
      "type": "string",
      "x-env-override": "DCCF_ADVERTISED_IPV4",
      "x-cpp-type": "std::string"
    },
    "sbi_bind_address": {
      "type": "string",
      "x-env-override": "DCCF_SBI_BIND_ADDRESS",
      "x-cpp-type": "std::string"
    },
    "metrics_bind_address": {
      "type": "string",
      "x-env-override": "DCCF_METRICS_BIND_ADDRESS",
      "x-cpp-type": "std::string"
    },
    "nrf_base_url": {
      "type": "string",
      "x-env-override": "DCCF_NRF_BASE_URL",
      "x-cpp-type": "std::string"
    },
    "redis_url": {
      "type": "string",
      "x-env-override": "DCCF_REDIS_URL",
      "x-cpp-type": "std::string"
    },
    "nrf_heartbeat_seconds": {
      "type": "integer",
      "x-env-override": "DCCF_NRF_HEARTBEAT_SECONDS",
      "x-cpp-type": "int"
    },
    "mfaf_base_url": {
      "type": "string",
      "x-env-override": "DCCF_MFAF_BASE_URL",
      "x-cpp-type": "std::string"
    },
    "amf_base_url": {
      "type": "string",
      "x-env-override": "DCCF_AMF_BASE_URL",
      "x-cpp-type": "std::string"
    },
    "nsacf_base_url": {
      "type": "string",
      "x-env-override": "DCCF_NSACF_BASE_URL",
      "x-cpp-type": "std::string"
    },
    "nwdaf_base_url": {
      "type": "string",
      "x-env-override": "DCCF_NWDAF_BASE_URL",
      "x-cpp-type": "std::string"
    },
    "user_consent_policy": {
      "type": "string",
      "x-env-override": "DCCF_USER_CONSENT_POLICY",
      "x-cpp-type": "std::string"
    },
    "oauth2_required": {
      "type": "boolean",
      "x-env-override": "DCCF_OAUTH2_REQUIRED",
      "x-cpp-type": "bool"
    }
  },
  "required": [
    "advertised_ipv4",
    "amf_base_url",
    "metrics_bind_address",
    "mfaf_base_url",
    "nrf_base_url",
    "nrf_heartbeat_seconds",
    "nsacf_base_url",
    "nwdaf_base_url",
    "port",
    "redis_url",
    "sbi_bind_address",
    "user_consent_policy"
  ],
  "x-config-file": "config/dccf.json",
  "x-source": [
    "nfs/dccf"
  ],
  "x-apply": "restart",
  "x-review": []
}
